title,rating
Bomba Electrica,385
Samsung Galaxy,3299
72 Marcadores,207
Cortinas Led,125
Paquete Llantas,3523
Cpu Amd Ryzen,2499
Porta Celular,154
Smartwatch,2650
Iphone 14,143
Samsung Galaxy A53,8299
Mochila De Gran Capacidad Con Cargador Usb,4.5
Colmi V33 Reloj Inteligente Mujer Con Temperatura Smartwatch,5.0
Tapabocas Cubrebocas Plisado Tricapa Termosellado Fda Y Ce,4.3
Máscara Luz Led La Purga Halloween La Purga Colores Calidad,4.7
"Funda Acrigel Para Samsung, Xiaomi, Poco/premium/uso Rudo",4.4
Samsung Galaxy A03 64 GB negro 4 GB RAM,4.6
Gel Limpiador Espumoso Cerave Piel Normal Grasa Acné 473 Ml,4.8
Chamarra That´s Hot Con Gorro Removible Para Hombre,3.8
Cargador Xiaomi Original Turbo 33w Con Cable Tipo C 6a,4.7
Samsung Galaxy S21 FE 5G 256 GB lavanda 8 GB RAM,4.6
Display Pantalla Touch Huawei Y6 2019 Negro,5.0
Funda Para iPhone X/xs/max/xr Otter Box Defender+clip,4.7
Procesador gamer AMD Ryzen 5 5600G 100-100000252BOX de 6 núcleos y  4.4GHz de frecuencia con gráfica integrada,4.9
Xiaomi Redmi Note 10S Dual SIM 128 GB blanco piedra 6 GB RAM,4.6
Gel Limpiador Espumoso Cerave Piel Normal A Grasa - 236ml,4.7
Kit Garnier Express Aclara Serum +crema +gel Con Vitamina C,4.6
"Samsung Galaxy Watch4 (Bluetooth) 1.4"" caja 44mm de  aluminio black, malla  black de  fluoroelastómero SM-R870",4.7
Cargador Xiaomi 18w Original Tipo C. Carga Rápida,4.8
Celular Samsung Galaxy A03 Core 32gb + 2gb Ram Light Green,4.4
Xg8 Audífonos Inalámbricos Con Bluetooth Resistentes Al Agua,4.5
Funda Samsung S22/plus/ultra Otterbox Defender Original+clip,4.5
"Smartwatch Para Mujer, Reloj Inteligente Deportivo Bluetooth",4.6
Cargador Inalámbrico Magnetico Qi Carga Rápida 15w Ios,3.1
Moto G60 Dual SIM 128 GB plata 4 GB RAM,4.6
Cargador Xiaomi 33w Original Tipo C. Turbo Cargador Mdy11ex,5.0
Reloj Inteligente Life Watch Mide Signos Vitales Cv Directo,4.0
Audífonos Inalámbricos,4.5
Samsung Galaxy A52 128 GB azul sorprendente 6 GB RAM,4.7
Mesa Plegable Portafolio Plastico 1.80m Resistente Garantia,4.6
Reloj Inteligente Resistente Al Agua Con Bluetooth,4.5
Pantalla Smart Tv Tcl 50 Pulgadas 4k Uhd Android Tv 50a445,4.7
Xiaomi Pocophone Poco M3 Pro 5G Dual SIM 128 GB azul hielo 6 GB RAM,4.6
Tenis De Seguridad Industrial Para Trabajo Hombre Ligero,4.7
Funda iPhone 13mini/pro/max Otter Box Defender Original+clip,4.9
Impresora a color multifunción HP Deskjet Ink Advantage 2374 blanca 100V/240V,4.5
Set 3 Bolsas Bandolera Mujer Cosmetiquera Cartera Borla Logo,4.2
Celular Motorola Moto G42 6.4'' 128gb 4gb Ram Oled Liberado,4.2
Taladro percutor inalámbrico de 10mm Teeno 5816-1 21V,4.5
Suplemento en polvo Optimum Nutrition  Gold Standard 100% Whey proteína sabor double rich chocolate en pote de 2.27kg,4.3
Soldadora inverter Swedish Husky Power HKS125 naranja y negra 60Hz 110V,4.7
Reloj Inteligente Fd68 Smartwatch Diseño Tipo Uso Rudo,3.0
Samsung Galaxy A03 64 GB azul 4 GB RAM,4.6
Pack 2 Mica Cristal Templado iPad 9/8/7 10.2  2021/2020/2019,4.5
Reloj Inteligente T500 Deportivo Contesta Llamadas,3.4
Aspiradora trapeadora robot ILife V5s Pro dorada 100V/240V,4.6
Kit Combo 8 En 1 Impresora Sublimar Sublimación Pmo Oferta 1,4.2
Zapatos De Seguridad De Fibra De Kevlar Transpirables,4.6
Guantes De Nitrilo Libre De Latex Sin Polvo Azul Negro,4.0
Xiaomi Redmi 10A Dual SIM 128 GB plata cromada 4 GB RAM,4.5
"Apple Watch Series 7 (GPS, 41mm) - Caja de aluminio color azul medianoche - Correa deportiva azul medianoche",4.9
Aspirador De Mano Portátil Para Hogar Y Automóvil,4.3
Xiaomi Pocophone Poco F4 Dual SIM 256 GB moonsilver 8 GB RAM,4.8
Tira De Luces Led App Bluetooth Control 5050 Rgb 20m (2x10m),4.6
Funda Apple Para iPhone 11 Pro Leather Case Original Cafe,4.5
"Reloj Inteligente Con Pantalla Táctil De 1,4/realme Watch 2",4.4
Celular Samsung Galaxy A03 Core 32gb 2gb Ram Liberado Dorado,5.0
Tenis De Entrenamiento Hombre Nike Air Max Alpha Trainer 5,4.9
Monitor Led 22 Qtouch Qt-2200 Hd 2022 Garantia,4.1
Cubrebocas Kn95 Tapabocas 5 Capas Reutilizables Certificado,4.2
Tenis De Seguridad Kevlar Con Puntera De Acero,4.7
Samsung Galaxy A52 128 GB violeta sorprendente 6 GB RAM,4.7
Pantalla Hisense 50a6 50'' 4k 60hz Bluetooth Google Tv,4.8
"Reloj Inteligente Huawei Watch Fit 1.64, Ritmo Cardíaco Spo2",4.8
Cubrebocas Tricapa Termosellado Plisado Negro 300 Piezas,4.2
Popping Pearl / Perlas Explosivas 3 Kg Soda Italiana,4.6
"Smartwatch Dizo Watch 1.4"" caja carbon grey, malla de  silicona",4.6
Tiras De Led Rgb 20 Metros Wifi Luces Led Alexa App Control,4.6
Xiaomi 12 Lite 128gb 8gb Negro,4.8
Chamarra Táctica Militar Shark Térmica Contra Agua Hombre,4.6
Mica De Hidrogel Para Modelos Xiaomi (ver Fotos),3.9
Funda Para iPhone 12mini/pro/max Otter Box Defender +clip,4.6
"Reloj Inteligente Deportivo Bluetooth, Smartwatch Para Mujer",5.0
ZTE Blade A71 64 GB blue 3 GB RAM,4.4
Sábanas King 2500 Hilos Tacto Suave Egipcio Premium,4.5
Silla Gamer Económica Reclinable Ergonómica Ouo,4.3
Guante Synamax Vinil Nitrilo Libre De Latex,4.2
Power Bank 20000 Mah Bateria Portatil Con Cable,3.2
Celular Samsung Galaxy A13 4g 128gb 4gb Ram Liberado Azul,4.6
Set De 4 Sillas Minimalistas Modernas Tipo Eames Comedor,3.4
Silla De Ruedas Económica,4.8
Xiaomi Pocophone Poco X4 Pro 5G Dual SIM 256 GB laser black 8 GB RAM,4.6
Proyector Xgody Led Android Wifi 8k Full Hd 1080p 8000lumens,5.0
Funda Para iPhone 11/pro/11 Pro Max Otter Box Defender+clip,4.8
Tenis Para Hombre Nike Air Max Sc,4.5
"Lentes Para Celular Apexel Con Tripie, Obturador Y Zoom 18x",4.3
Reloj Deportivo Inteligente Bluetooth Impermeable,4.4
Xiaomi Pocophone Poco M3 Pro 5G Dual SIM 128 GB power black 6 GB RAM,4.6
Protector Mica Lente Cámara Para iPhone Individual Metal,3.1
Taladro Atornillador Alto Impacto Con 2 Baterías De Litio,4.2
Samsung Galaxy A03 64 GB rojo 4 GB RAM,4.6
Microsoft Xbox Series S 512GB Standard color  blanco,4.9
Cargador Samsung Super Carga Rápida S21 Plus 25w Original,4.2
Funda Ultra Slim Para Xiaomi Redmi Poco,4.4
Soldadora Inversora Maquina 130amp 110/220v Str14e Stallion,4.6
1.69'' Reloj Smart Watch Mujer Con Temperatura Pulsera Doble,4.5
Xiaomi Redmi Note 11 (Snapdragon) Dual SIM 128 GB gris grafito 6 GB RAM,4.6
Amazon Echo Dot 4th Gen con asistente virtual Alexa twilight blue 110V/240V,4.8
Proyector Profesional 8k Android Wifi Full Hd 1080p 8000 Lm,5.0
Google Chromecast 3.ª generación Full HD carbón,4.8
Cámara De Seguridad Wifi Exterior 1080p Con Led Iluminación,4.3
Reloj Inteligente Deportivo Impermeable Con Bluetooth,4.5
Xiaomi Pocophone Poco X4 Pro 5G Dual SIM 256 GB laser blue 8 GB RAM,4.6
Cargador Samsung Original Super Carga Rapida 25w Tipo C,4.6
Kit Funda Magsafe + Mica Pantalla + Mica Cámara Para iPhone,4.4
Reloj Smart Watch Mujer Deportivo Impermeable Para Hombre,4.9
Xiaomi Redmi 10C Dual SIM 128 GB gris grafito 4 GB RAM,4.7
Arbol Navidad Artificial Frondoso 1.90 M Verde Pino Jardimex,4.4
Colchón Individual Ortopédico + 2 Almohadas Spring Air,4.6
Funda Case De Uso Rudo Para iPhone Transparente Antigolpes,4.8
"Huawei Band 6 1.47"" caja de  polímero dark gray, malla  graphite black de  silicona FRA-B19",4.8
Xiaomi Redmi Note 11 (Snapdragon) Dual SIM 128 GB azul estelar 6 GB RAM,4.6
"Tablet  Samsung Galaxy Tab A7 Lite with Book Cover SM-T220 8.7"" 32GB plateada y 3GB de memoria RAM",4.8
Kit Funda Para iPhone Magsafe Cargador Mica Camara Pantalla,3.8
"Xiaomi Mi Smart Band 5 1.1"" caja de  plástico pc black, malla  black de  elastómero termoplástico y aleación de aluminio XMSH10HM",4.8
Samsung Galaxy A53 5G 128 GB awesome peach 8 GB RAM,4.5
Cargador Xiaomi 33w Original Tipo C. Turbo Cargador Mdy11ex,4.7
Funda Ultra Slim Para  Samsung Galaxy,4.5
"Tablet  Samsung Galaxy Tab A7 Lite with Book Cover SM-T220 8.7"" 32GB gris y 3GB de memoria RAM",4.8
Smartwatch Mujer 1.85 Reloj Inteligente Reloj Impermeable,4.6
Samsung Galaxy M13 Dual SIM 64 GB deep green 4 GB RAM,4.6
